CPF;Nome;Nacionalidade;Data de Nascimento;País de nascimento;UF de nascimento;Município de nascimento;Nome do pai;Nome da mãe;Tipo;N° *;Órgão de expedição *;UF de expedição *
109.091.005-35;KETILLY DE OLIVEIRA SANTOS;Brasil;24/11/2005;Brasil;SE;Estância;JAILSON DE OLIVEIRA SANTOS;JAQUELINE CRUZ DOS SANTOS;Carteira de identidade;4.002.442-3;SSP;SE
091.664.475-85;KAINAN SIQUEIRA SILVA ;Brasil;10/12/2005;Brasil;SE;Estância;ERIK FERREIRA SILVA;MARIA GLAUCIENE FERREIRA SIQUEIRA;Carteira de identidade;4.121.652-0;SSP;SE
077.081.325-92;MARIA EDUARDA NONATO FARIA SILVEIRA;Brasil;22/03/2007;Brasil;SE;Estância;CARLOS EDUARDO ALVES SILVEIRA;GRACIANE NONATO FARIA SILVEIRA;Carteira de identidade;3.529.893-6;SSP;SE
063.082.775-33;MARIA CLARA SANTOS ARAUJO;Brasil;11/05/2007;Brasil;SE;Aracaju;JOSE ALTION CERQUEIRA ARAUJO;MARCIA SANTOS MIRANDA;Carteira de identidade;09.460.113-5;SSP;SE
074.103.245-70;KEROLLAINE MORGANE DE JESUS MORAES;Brasil;21/08/2006;Brasil;SE;Estância;ALISON MANOEL PEREIRA MORAES;KEROLLEN MORGANE FRANCA DE JESUS MORAES;Carteira de identidade;4.039.395-0;SSP;SE
082.039.155-74;VINICIUS MANOEL RODRIGUES MORAIS ;Brasil;18/12/2006;Brasil;SE;Estância;ANTONIO MANOEL RODRIGUES MORAIS;SIMONE RODRIGUES MORAIS;Carteira de identidade;3.843.303-6;SSP;SE
